{
  "agent": "feniks",
  "skill": "phoenix-eval",
  "task_id": "feniks-ym-report-otchet-iter3-20261001",
  "timestamp": "2026-10-01T18:01:34+03:00",
  "deliverable_ref": "branch claude/brave-ritchie-1w4f1i @ af5a749f5 (итерация 3, дельта после вливания main 0008f82: OZON #447, #448, снимки 01.10), audit hash 4449806e1df81dcd",
  "iteration": 3,
  "artifact_class": "dashboard",
  "audience": "Иван Раюшкин (руководитель), Катя (пользователь вкладки)",
  "anchor": "8.1 feniks-return-reestr после доработки (тот же класс) - наш артефакт ниже на 0.05: независимое воспроизведение того же уровня (сырой реестр свежего снимка, названия товаров, блок «Деньги», ДРР 16 из 16 строк = «Маркетинг», инвариант услуг на 18 окнах), но свежий снимок вскрыл дефект, которого у реестра не было: последний день реестра систематически без сборов (6 из 6 последних дней кабинетов в 4 снимках), отчёт показывает такой период как полный, а утверждённый эталон спеки посчитан на таком дне. Падение 8.45 -> 8.05 даёт этот дефект, а не дельта слияния: код отчёта не менялся",
  "probes": [
    {"id": "M1", "result": "PASS", "evidence": "git diff 5a8a9f3 af5a749 по ym/, report-page.ts (REPORT_JS) и ym-monthly-report.yaml пуст; ветка относительно main 0008f82 в build-katya.ts несёт только свои ханки Маркета (импорт, переключатель, banner, блок if (!IS_OZON)) - те же, что в итерациях 1-2. Изменения #447/#448 в общем pageJs страницу отчёта не ломают: ошибок консоли на «Отчете», «Деньгах», «Маркетинге» 0"},
    {"id": "B6", "result": "PASS", "evidence": "Пересборка ym:build из af5a749 в scratchpad: 18 страниц совпали с закоммиченными, кроме строки времени сборки; smoke 18/18; vitest 59 файлов / 870 тестов; report-page-ym 18/18, включая «все имена находятся в REPORT_JS» (pickJs после #448 работает); трейсы после слияния 68/68 валидны"},
    {"id": "B2", "result": "PASS", "evidence": "Свежий снимок, реестр по 30.09 у обоих кабинетов: сентябрь целиком 01-30.09 против августа 01-31.08, partial=false. Сырой netting.ndjson: сентябрь 4 522 564 / 155 шт (зеркала 822 145 / 38, мебель 3 700 419 / 117), август 4 775 107 / 174 (1 598 598 / 80, 3 176 509 / 94) - совпало со страницей"},
    {"id": "B4", "result": "PASS", "evidence": "Отчёт = блок ACC на «Деньгах» для 01-30.09 (4 522 564 / 155 / 761 441 / 3 761 109 / 175 550) и августа; ДРР: 16 из 16 строк «месяц x кабинет» = таблица #pm-mon вкладки «Маркетинг» той же сборки"},
    {"id": "X5", "result": "PASS", "evidence": "18 окон свежего снимка: флаги ошибок сборки (зеркала+мебель, тождество, услуги) не сработали ни разу; наибольшее |сумма услуг - колонка блока| 45,28 ₽; на странице только пометка об округлении -2 / 14 ₽"},
    {"id": "X8", "result": "FAIL", "evidence": "c16.py, c17.py: в каждом из 4 снимков (28.09, 29.09, 30.09, 01.10) у каждого кабинета последний день реестра имел оплаты покупателей и 0 ₽ сборов по заказам; сборы приходили следующим снимком: 27.09 -9 065 и -11 982, 28.09 -19 396, 29.09 -3 903 и -21 594. Сейчас 30.09: оплата 19 903, сборов 0. Отчёт берёт границей последний день с любой проводкой (report-page-ym.ts:68-72, как ledgerToBy в derive-lib.ts:943) и показывает сентябрь полным без пометки"}
  ],
  "comprehension_gate": {
    "applies": false,
    "passed": true,
    "defects": []
  },
  "checkpoints": {
    "accuracy_1_figures_tagged": 2,
    "accuracy_2_sources_verifiable": 1,
    "accuracy_3_no_conflict_with_rag": 1,
    "accuracy_4_glossary_terminology": 1,
    "accuracy_5_brand_names_correct": 2,
    "actionability_6_owner_assigned": 2,
    "actionability_7_deadline_buffer": 2,
    "actionability_8_resources_listed": 2,
    "actionability_9_metric_concrete": 2,
    "actionability_10_milestone": 2,
    "insight_11_nontrivial": 2,
    "insight_12_second_order": 1,
    "insight_13_alternatives_analyzed": 2,
    "insight_14_anti_median": 2,
    "insight_15_cross_domain": 0,
    "brand_16_voice": 2,
    "brand_17_anti_slop": 2,
    "brand_18_no_em_dash": 1,
    "brand_19_output_routing": 2,
    "brand_20_tone_audience": 2,
    "risk_21_downside": 1,
    "risk_22_p9_hard_rules": 2,
    "risk_23_crisis_scenarios": 1,
    "risk_24_dependencies": 1,
    "risk_25_reversibility": 2
  },
  "scores": {
    "accuracy": 7.0,
    "actionability": 10.0,
    "insight": 7.0,
    "brand_fit": 9.0,
    "risk_awareness": 7.0
  },
  "weighted_total": 8.05,
  "verdict": "go",
  "primary_gap": "Последний день реестра систематически приходит без сборов (6 из 6 последних дней кабинетов в 4 снимках, сборы - следующим снимком). Сентябрь сегодня показан полным без сборов за 30.09, неполный месяц всегда сравнивается с окном, где у последнего дня нет сборов; эталон спеки «01-29.09» посчитан на таком дне",
  "gaps": [
    "I1 accuracy_3 / risk_21 (-0.4, новый, не от дельты): последний день реестра без сборов. На снимке 30.09 за 01-29.09 сборы 735 944, на снимке 01.10 за те же даты 761 441 (+25 497 за 29.09), К выплате 3 766 703 -> 3 741 206, Чистая по артикулам 192 138 -> 174 290 (-9,3%), с общими 149 052 -> 131 204. Сегодня сентябрь 01-30.09 показан полным без пометки, сборов за 30.09 нет (оплата 19 903 есть). Неполный месяц всегда сравнивает окно без сборов последнего дня с полным окном прошлого месяца. Исправление: граница = последний день со сборами по заказам у каждого кабинета (минимум по активным) или пометка «сборы за последний день реестра ещё не пришли»; эталон в спеке пересчитать или пометить",
    "I2 эталон спеки (часть I1): golden_examples «01-29.09» (сборы 735 944, К выплате 3 766 703, Чистая 192 138, с общими 149 052) посчитаны без сборов за 29.09 и на текущих данных не воспроизводятся - записать оговорку и значения по снимку 01.10",
    "H1 (из итерации 2, открыт): вырез pmRow в try/catch - ДРР молча «нет данных»; замена «реализовано» без теста",
    "H2 (из итерации 2, открыт): «Компенсация за потерянный заказ» подписана названием товара в группе «Штрафы и прочие услуги»",
    "H3 (из итерации 2, открыт): кабинеты и подписи литералами вместо PM_NAMES",
    "H4 (из итерации 2, открыт): порог флага услуг = число строк окна при шуме не больше 45 ₽",
    "H5 (из итерации 2, раскрыто): деньги за август-сентябрь не сверены с документом другого семейства; разборка августа 174 против 153 есть в отчёте итерации 2"
  ],
  "evidence_ledger": [
    {"gap": "I1 Последний день реестра без сборов, период показан полным", "evidence": "c16.py: diff netting.ndjson 5a8a9f3 -> af5a749: +34 строки, все датой 29.09-30.09, 29.09 «Удержание / Оплата услуг Маркета» -25 497,52 (раньше 0); c17.py по снимкам 0f4245e, 60ec3c2, 40203c1, a1a70b1: у каждого кабинета последний день - оплаты есть, сборы 0, в следующем снимке сборы появились (27.09 -9 065 / -11 982, 28.09 -19 396, 29.09 -3 903 / -21 594); DOM katya-money.html окно 01-29.09: 4 502 661 / 154 / 761 441 / 3 741 206 / 174 290; report-page-ym.ts:68-72 (граница = последний день с любой проводкой), rpPeriods partial=false при REPY.to = конец месяца", "checkpoint": "accuracy_3, risk_21", "weight": -0.4},
    {"gap": "I2 Эталон спеки посчитан на неполном дне", "evidence": "ym-monthly-report.yaml golden_examples «2026-09-01..2026-09-29»: fees 735944, payout 3766703, net 192138; на снимке 01.10 те же даты: 761 441 / 3 741 206 / 174 290 (DOM «Деньги»)", "checkpoint": "accuracy_3", "weight": 0}
  ],
  "rework_tz": "",
  "escalate_to": "Иван Раюшкин: сентябрь на странице сегодня (снимок 01.10) без сборов за 30.09 - «Всего сборов», «К выплате» и «Чистая» сентября изменятся со снимком 02.10; на снимке 30.09 то же дало «Чистую» за 01-29.09 на 10% выше (192 138 против 174 290)",
  "sources_of_truth": [
    "analytics-mvp/data-ym/netting.ndjson в снимках 0f4245e (28.09), 60ec3c2 (29.09), 40203c1 (30.09), a1a70b1 (01.10)",
    "analytics-mvp/public/market/katya-report.html, katya-money.html, katya-marketing.html @ af5a749 (DOM)",
    "knowledge/semantic/metrics/ym-monthly-report.yaml (golden_examples)"
  ],
  "p9_triggers_fired": ["цифры в дашборде"],
  "confidence": 0.86
}
