{
  "agent": "feniks",
  "skill": "phoenix-eval",
  "task_id": "ozon-ads-window-receipts-20261023",
  "timestamp": "2026-10-23T08:14:10.353769+00:00",
  "deliverable_ref": "commit:b4244fde2ef2f48c971f975312724527532f2dc6; audited_hash=dcbb5d6835495896",
  "iteration": 2,
  "artifact_class": "dashboard",
  "anchor": "8.1 dialogs-registry after rework - выше на0.30: прежний producer/consumer lifecycle regression устранён, независимые граничные пробы проходят. Ниже8.9annotate: публикация и live-результат нового receipt ещё не проверены.",
  "comprehension_gate": {
    "applies": false,
    "passed": true,
    "defects": []
  },
  "checkpoints": {
    "accuracy_1_figures_tagged": 1,
    "accuracy_2_sources_verifiable": 2,
    "accuracy_3_no_conflict_with_rag": 2,
    "accuracy_4_glossary_terminology": 2,
    "accuracy_5_brand_names_correct": 2,
    "actionability_6_owner_assigned": 2,
    "actionability_7_deadline_buffer": 2,
    "actionability_8_resources_listed": 2,
    "actionability_9_metric_concrete": 2,
    "actionability_10_milestone": 1,
    "insight_11_nontrivial": 2,
    "insight_12_second_order": 1,
    "insight_13_alternatives_analyzed": 2,
    "insight_14_anti_median": 1,
    "insight_15_cross_domain": 0,
    "brand_16_voice": 2,
    "brand_17_anti_slop": 2,
    "brand_18_no_em_dash": 2,
    "brand_19_output_routing": 2,
    "brand_20_tone_audience": 1,
    "risk_21_downside": 2,
    "risk_22_p9_hard_rules": 2,
    "risk_23_crisis_scenarios": 1,
    "risk_24_dependencies": 2,
    "risk_25_reversibility": 2
  },
  "scores": {
    "accuracy": 9,
    "actionability": 9,
    "insight": 6,
    "brand_fit": 9,
    "risk_awareness": 9
  },
  "weighted_total": 8.4,
  "verdict": "go",
  "gaps": [
    "Публикация и результат штатной загрузки после этого патча ещё не проверены. До заявления о восстановленном интерфейсе требуется проверить новый ledger и допуск22.10 на main/живом сайте."
  ],
  "rework_tz": "",
  "confidence": 0.96,
  "p9_triggers_fired": [
    "advertising dashboard numbers",
    "source receipt persistence"
  ],
  "probes": [
    {
      "id": "B1",
      "result": "PASS",
      "evidence": "Независимо просуммированы первичные collected NDJSON:43629377=116/116руб,43629636=135/135руб за22.10; старый fullstate22.10 объясняет исходный пропуск."
    },
    {
      "id": "B2",
      "result": "PASS",
      "evidence": "Исходное воспроизведение последовательных окон16-22.10 и23-29.10 теперь оставляет день22.10 принятым. Собственная дата каждого окна сохраняется."
    },
    {
      "id": "B3",
      "result": "PASS",
      "evidence": "Патч не меняет ключи/строки/суммы; receipt связан с cid и диапазоном. Никакой агрегации SKU или дублирования кампаний не добавлено."
    },
    {
      "id": "B4",
      "result": "PASS",
      "evidence": "Production saveCorrections→metadata→adsFullDay сохраняет старый receipt и raw95% при прежнем fullstate.18самостоятельных проверок подтверждают дедуп точного диапазона, отсутствие повышения чужого timestamp и отказ при некорректных receipts."
    },
    {
      "id": "B5",
      "result": "PASS",
      "evidence": "Расходы и недели не захардкожены новым кодом; порог95% сохранён. Все5неисключённых путей прочитаны."
    },
    {
      "id": "B6",
      "result": "PARTIAL",
      "evidence": "Ранее проверенные источники/одноразовые гейты перенесены без повторного полного прогона. Авторские181PASS/strictTypeScript записаны; локальный lifecycle и18новых независимых проверок PASS. Main/live-результат нового патча ещё не проверен."
    },
    {
      "id": "B7",
      "result": "PASS",
      "evidence": "Receipt без skuSp не допускается; при94/100 день остаётся неизвестным,при95/100 допускается. Денежные формулы и старые ошибки истории не скрываются."
    }
  ],
  "evidence_ledger": [
    {
      "gap": "Публикация и результат штатной загрузки после этого патча ещё не проверены. До заявления о восстановленном интерфейсе требуется проверить новый ledger и допуск22.10 на main/живом сайте.",
      "evidence": "Повторный аудит выполнен локальными production saveCorrections→metadata→adsFullDay с управляемым временем. Новые сетевые данные/страница в рамках аудита не публиковались.",
      "checkpoint": "risk_23_crisis_scenarios",
      "weight": -1
    }
  ],
  "sources_of_truth": [
    "outputs/test4-close-2026-10-23/collected/ads_daily.ndjson",
    "outputs/test4-close-2026-10-23/collected/ads_sku_daily.ndjson",
    "outputs/test4-close-2026-10-23/collected/ads_sku_state.json",
    "knowledge/semantic/metrics/ozon-ads-window-receipts-20261023.yaml",
    "/Users/gengroup/Documents/Codex/outputs/audit-ads-window-receipts-20261023/audit-receipts-lifecycle-result.json",
    "/Users/gengroup/Documents/Codex/outputs/audit-ads-window-receipts-20261023/iter2/audit-receipts-lifecycle-result.json",
    "/Users/gengroup/Documents/Codex/outputs/audit-ads-window-receipts-20261023/iter2/audit-receipts-ledger-result.json"
  ],
  "audience": "Иван Раюшкин; internal dashboard"
}
