{
  "agent": "feniks",
  "skill": "phoenix-eval",
  "task_id": "feniks-ym-money-flow-7-iter3-20261014",
  "timestamp": "2026-10-14T09:25:56+00:00",
  "deliverable_ref": "ветка claude/brave-ritchie-1w4f1i (пересоздана от main 1ff6c1e после squash #471), голова 9fe9714 (= origin); пути хеша: analytics-mvp/src/scripts/ym/derive-lib.ts, derive-lib.test.ts, report-page-ym.ts, report-page-ym.test.ts; self-check knowledge/episodes/2026-10/selfcheck-ym-money-flow-7-20261014.md с поправками брифа (п.18, п.11)",
  "artifact_class": "dashboard",
  "audience": "internal: собственник и Катя (вкладка «Отчет» Маркета, выгрузка Excel)",
  "iteration": 3,
  "anchor": "8.0 против 8.1 feniks-return-reestr (после доработки, go): ниже на 0.1. Как и там, числа воспроизведены независимо до рубля, а расхождения с внешним документом разобраны до причины (здесь сверка с актом: июнь-сентябрь точная, февраль-март - перенос на границе месяцев, подтверждён реестром по заказам). Ниже из-за непроверенной выпиской строки «Перевёл» и 8 живых мутантов из 14, среди них сама пометка B7. Серия: итерация 1 без скоринга, итерация 2 7.55, итерация 3 8.0",
  "probes": [
    {
      "id": "R1",
      "result": "PASS",
      "evidence": "песочница git archive 9fe9714 (данные main 13.10): build-katya exit 0, рендер jsdom по 10 месяцам, 0 ошибок JS; ветка = main 1ff6c1e + 1 коммит, merge-base = origin/main"
    },
    {
      "id": "B6",
      "result": "PASS",
      "evidence": "vitest src/scripts/ym: 340 passed + 2 артефакта песочницы (validate-facts читает ../.github/workflows) = 342 брифа; рендер совпал с брифом: компенсации февраля 36 457, остаток сверки мебели февраль -40 538 / март 41 298, май -594"
    },
    {
      "id": "B1",
      "result": "PASS",
      "evidence": "chk3.py по сырому реестру: строк вида «прочее» по заказу во всех данных ровно одна - февраль, мебель, «Утеря или порча отправления заказа» +36 457; сборы по заказам в реестре 01.03: мебель -40 168.52 (сдвиг по сверке 40 538 и 41 298), зеркала -10 677.10; три заказа-примера автора имеют сборы 01.03 (-1 025.93, -3 884.37, -7 207.91) и строки в феврале; зеркала: февраль + март = 8 718 против удержания 01.02 8 731.67 (разница 14 ₽)"
    },
    {
      "id": "B2",
      "result": "PASS",
      "evidence": "сверка с актом только по целым месяцам; частичные периоды «нет данных»; числа движения не менялись с итерации 2"
    },
    {
      "id": "B3",
      "result": "PASS",
      "evidence": "дедуп и сборщик не менялись (итерация 1: 0 ключей, различающихся только п/п)"
    },
    {
      "id": "B4",
      "result": "PARTIAL",
      "evidence": "Начислил и К выплате блока 7 = блоку 3 во всех колонках. «Списал за услуги по заказам» февраль -599 579 против «Всего сборов» блока 3 563 119: разница 36 460 = компенсация 36 457 + округление; подсказка f_fee больше не ссылается на блок 3. Январь: «Списал» прочерк (fee в NS), блок 3 - 780 089; объяснено пометкой о месяцах без статуса"
    },
    {
      "id": "B5",
      "result": "PASS",
      "evidence": "новых денежных литералов нет; пороги 10% и 100 ₽ в rpyActRes названы в комментариях"
    },
    {
      "id": "B7",
      "result": "PASS",
      "evidence": "пометка под блоком (rp-flow-note, она же в Excel через rpxLines, код выгрузки с итерации 2 не менялся): дата снимка 13.10.2026, последняя платёжка по кабинетам (зеркала и мебель по 30.09.2026), «Перевёл на счёт с банковской выпиской не сверен», замороженные статусы июня, остатки сверки с актом по всем месяцам на экране с причиной или «причина не разобрана»"
    },
    {
      "id": "M1",
      "result": "PARTIAL",
      "evidence": "mut3.py, 14 мутантов: убиты 6 (компенсации в Списал, oth не копится, сборы по заказам в «без заказа», допуск переноса 10% на 100%, порог остатка rpyActRes, знак удержания 1-го числа); живы 8: N1 граница accTo, N8, N9 ветки сверки, N12 строка «не сверен», N13 порог плашки, P5 перенос без проверки знака, P7 звёздочка только по первому кабинету (бриф: тест «звёздочка по кабинетам» добавлен), P8 пометка о замороженных статусах"
    },
    {
      "id": "C3",
      "result": "PASS",
      "evidence": "U+2014 в добавленных строках: 0 (G3 итерации 2 закрыт, п.18 self-check теперь верен)"
    }
  ],
  "comprehension_gate": {
    "applies": false,
    "passed": true,
    "defects": []
  },
  "checkpoints": {
    "accuracy_1_figures_tagged": 1,
    "accuracy_2_sources_verifiable": 2,
    "accuracy_3_no_conflict_with_rag": 1,
    "accuracy_4_glossary_terminology": 2,
    "accuracy_5_brand_names_correct": 2,
    "actionability_6_owner_assigned": 1,
    "actionability_7_deadline_buffer": 1,
    "actionability_8_resources_listed": 2,
    "actionability_9_metric_concrete": 1,
    "actionability_10_milestone": 2,
    "insight_11_nontrivial": 2,
    "insight_12_second_order": 1,
    "insight_13_alternatives_analyzed": 2,
    "insight_14_anti_median": 2,
    "insight_15_cross_domain": 0,
    "brand_16_voice": 2,
    "brand_17_anti_slop": 2,
    "brand_18_no_em_dash": 2,
    "brand_19_output_routing": 2,
    "brand_20_tone_audience": 2,
    "risk_21_downside": 2,
    "risk_22_p9_hard_rules": 2,
    "risk_23_crisis_scenarios": 1,
    "risk_24_dependencies": 2,
    "risk_25_reversibility": 2
  },
  "scores": {
    "accuracy": 8.0,
    "actionability": 7.0,
    "insight": 7.0,
    "brand_fit": 10.0,
    "risk_awareness": 9.0
  },
  "weighted_total": 8.0,
  "verdict": "go",
  "primary_gap": "Защиты блока не держатся тестами: 8 из 14 мутантов живы, в том числе строка «Перевёл не сверен с выпиской», порог плашки, пометка о замороженных статусах и звёздочка по второму кабинету",
  "gaps": [
    "H1 Тесты: 8 из 14 мутантов живы (N1, N8, N9, N12, N13, P5, P7, P8); тест «звёздочка по кабинетам» не падает, если проверять только первый кабинет",
    "H2 «Списал» блока 7 и «Всего сборов» блока 3 расходятся на компенсацию (февраль 599 579 против 563 119); подсказка «Списал» больше не говорит, как они связаны",
    "H3 rpyActRes подписывает любую пару соседних месяцев разного знака, гасящуюся до 10%, как «перенос услуг на границе месяцев»; данными это подтверждено только для февраля-марта 2026, будущие пары получат ту же подпись без проверки",
    "H4 Сверка «Перевёл» с выпиской банка не проведена, срок и ответственный не назначены (на странице помечено)"
  ],
  "evidence_ledger": [
    {
      "gap": "H1 8 из 14 мутантов живы",
      "evidence": "mut3.py: N1, N8, N9, N12, N13, P5, P7, P8 живы при 107/107 тестов; P7 заменяет проверку двух кабинетов на один (зеркала) - тест «звёздочка по кабинетам» из брифа его не ловит",
      "checkpoint": "actionability_9",
      "weight": -0.25
    },
    {
      "gap": "H2 Списал против Всего сборов",
      "evidence": "show.py out3/render.json 2026-09: февраль «− Списал за услуги по заказам» -599 579, «+ Компенсации» 36 457; блок 3 «Всего сборов = затраты площадки» 563 119; подсказка f_fee: «сборы Маркета деньгами: размещение, доставка, эквайринг, хранение, продвижение» без ссылки на блок 3",
      "checkpoint": "accuracy_3",
      "weight": -0.25
    },
    {
      "gap": "H3 правило «перенос» шире проверенного",
      "evidence": "report-page-ym.ts rpyActRes: условие a*b<0 и |a+b| <= 0.1*max(|a|,|b|) (или до удержания 1-го числа); мутант P5 (без проверки знака) жив; подтверждение данными есть только для 2026-02/03 (chk3.py: сборы 01.03 мебель -40 168.52, заказы-примеры)",
      "checkpoint": "insight_12",
      "weight": -0.2
    },
    {
      "gap": "H4 выписка банка",
      "evidence": "бриф: «G7 (выписка банка) - не в объёме, ждёт пользователя»; self-check п.6 «срок не назначен»",
      "checkpoint": "actionability_6",
      "weight": -0.25
    }
  ],
  "rework_tz": "Не блокирует слияние. (1) H1: тесты, которые падают на N12 (строка «не сверен»), N13, P8 (замороженные статусы), P7 (отстаёт только мебель), P5 (пара одного знака), N1 (строка ровно в accTo), N8 (взнос не равен кампаниям, как в июле), N9 (последний месяц). (2) H2: в подсказке «Списал» написать «Списал − Компенсации = «Всего сборов» блока 3 (± рубли округления)». (3) H3: подпись «похоже на перенос», пока нет подтверждения; рядом показывать сумму сборов по заказам 1-го числа второго месяца. (4) H4: срок и ответственный за сверку «Перевёл» с выпиской.",
  "confidence": 0.82
}
