{
  "agent": "feniks",
  "skill": "phoenix-eval",
  "task_id": "feniks-ozon-plan-tab-iter3-d27ad7b-20261015",
  "timestamp": "2026-10-15T13:15:00+03:00",
  "deliverable_ref": "блок «План с 15.10» страницы «Тесты» OZON, ветка claude/amazing-hawking-0trncq @ d27ad7b (доработка 57f05d8..d27ad7b по return iter2): analytics-mvp/src/scripts/plan-tab.ts, plan-tab/plan-tab.client.js, plan-tab.test.ts, knowledge/semantic/metrics/ozon-plan-15-10.yaml, knowledge/decisions.md (запись блока); self-check knowledge/episodes/2026-10/selfcheck-ozon-plan-tab-20261015.md (раздел iter3). Охват узкий: audit_hash --rev d27ad7b = e0dbe4456acdec3d, хеша в запросе нет; MEMORY.md, semantic/metrics ozon-v5/v6, sessions/2026-10-14-* не аудированы, audited_hash не пишу. За время аудита ветка ушла на fe85157: после d27ad7b только decisions.md (+1 запись о составе карточки, цифры 59/49 и 21/18 сверены), handoff и traces, код тот же",
  "iteration": 3,
  "artifact_class": "dashboard",
  "anchor": "8.5 timur-activation (итерация 3, go) - наш артефакт выше на 0.2: как у ТИМУРА iter3, закрытие прошлого return доказано live-пробами, а не чтением (фикстуры msk_t / msk_r / wipe3, независимый пересчёт дня по МСК 48 дней без расхождений), и регресса нет (PD побайтно равны на 4 здоровых фикстурах, страница отличается только правками). Ниже 8.9 annotate: там остаток был формулировкой, здесь новая проба дня решения нашла N8 (утром 29.10 на странице заказы по 27.10)",
  "probes": [
    {"id": "R1", "result": "PASS", "evidence": "пересборка в scratch (OUT_DIR), public/ и data/ не тронуты (sha1 ads_sku_state.json = HEAD). jsdom 0 ошибок на странице и 11 фикстурах, дублей id 0, em dash 0, anti-slop 0 попаданий (чекер жив: контрольная фраза из списка ловится). vitest plan-tab 36/36, весь vitest 1008/1012 (4 падения ym/*, как в iter2), tsc 0 ошибок в plan-tab*"},
    {"id": "B1", "result": "PASS", "evidence": "p3_msk_check.py на реальных данных: отмены по штукам 16/124 = 12,9% (01-10.10) и 2/31 = 6,5% (11-13.10) = текст страницы; p3_nopos.py: без позиции GENTRIS, TRUBIS L120, ARFEO (0 строк в funnel_tests) = текст; p3_trubis.py: TRUBIS 160 48 товаров, 59 заказано / 49 без отмен = эталон и запись decisions.md, 160x80 9 товаров 21 / 18"},
    {"id": "B2", "result": "PASS", "evidence": "day1 «рано»; nov «Заказы магазина 70%, 19 из 27, ноябрь 409»; PD базы 57f05d8 и d27ad7b побайтно равны на day1, nov, mid3, msk_not"},
    {"id": "B3", "result": "PASS", "evidence": "p3_keys.py: (order,sku) 3780/3780, (cid,d,sku) 2490/2490, (id,d) 4470/4470"},
    {"id": "B4", "result": "PASS", "evidence": "определение дня одно на 4 поверхностях: шапка plan-tab.ts:15-16, decisions.md, спека timezone/partial_period, подпись при 0 из 3780 «пока по UTC». N6 в jsdom: «Магазин» расход и CPC затенены с 14.10 (данные по 13.10), наборы по товарам с 13.10 (по 12.10)"},
    {"id": "B5", "result": "PASS", "evidence": "доли отмен и список без позиции считаются в planBlock (plan-tab.ts:330-335). «Примерно на 3,5%» и «20,4 млн» в plan-tab.ts:361 - константы замороженного плана и закрытой базы: p3_g8drift.py даёт +3,2...+4,1% с учётом поздних отмен, в пределах «примерно»"},
    {"id": "B6", "result": "PARTIAL", "evidence": "«Данные: воронка по 13.10, заказы по 13.10, реклама по товарам по 12.10» = max d источников. Но утром дня решения заказы на странице по позавчера, а дата видна только в свёрнутом «Как считаем» (N8, проба Z1)"},
    {"id": "B7", "result": "PASS", "evidence": "msk_t: od_last 20.10 (база 57f05d8: 21.10), n_in 6 (7), «Весь магазин» идём (отстаём), «10 из 66» (78), «заказы по 20.10» (21.10). msk_r, время заказа по 24 часам: od_last 20.10, отброшен 1 заказ хвоста, база воспроизводит дефект (21.10, «12 из 78»)"},
    {"id": "M1", "result": "PASS", "evidence": "p3_msk_check.py на msk_r: независимый счёт по дню МСК против PD.store.orders - 48 дней, 0 расхождений; магазин 15-20.10 = 88, 01-14.10 = 149, 01-20.10 = 237 = страница; отмены 12/140 = 8,6% и 2/44 = 4,5% = текст"},
    {"id": "K7", "result": "PASS", "evidence": "сбой отчёта своей кампании TRUBIS 160: база на wipe / wipep / wipe3 - «Реклама 0% · 0 из 86 тыс. ₽ · ✓ в плане»; d27ad7b - «по 12.10» (wipep) и «нет данных» (wipe3, стёрто окно 62 дня). Здоровый mid3 = база (16.10, «5 714 за 2 дн 100%»). Порог 95% на истории: p3_cov2.py - сентябрь-октябрь 0 из 1031 собранных кампания-дней ниже 95%, минимум 08-12.10 = 0,999"},
    {"id": "T1", "result": "PASS", "evidence": "plan-tab импортирует только build-tests.ts; страница «Тесты» против сборки iter2 отличается только правками блока (подпись дня, текст отмен, client.js N6) и временем сборки (токенный diff 15 строк)"},
    {"id": "Z1", "result": "FAIL", "evidence": "утро решения 29.10. Коммиты orders-backfill 09:52-13:21 UTC (7 из 7, git log --all), с [skip ci]; сайт получает их с деплоем после OZON snapshots (коммиты 10:57-13:51 UTC). 12.10 коммита заказов не было. Фикстуры dec28 / dec27, today 29.10: при заказах по 27.10 чип «день 14 из 14 · проверка 29.10», TRUBIS 160 «26, осталось 5, отстаём» вместо «31, осталось 0, идём». Не B7: каждое число верно на свою дату, статусы пересчитаны на 13 дней. Дефект в заметности: дата данных только в свёрнутом блоке"}
  ],
  "checkpoints": {
    "accuracy_1_figures_tagged": 2,
    "accuracy_2_sources_verifiable": 2,
    "accuracy_3_no_conflict_with_rag": 1,
    "accuracy_4_glossary_terminology": 2,
    "accuracy_5_brand_names_correct": 2,
    "actionability_6_owner_assigned": 2,
    "actionability_7_deadline_buffer": 1,
    "actionability_8_resources_listed": 2,
    "actionability_9_metric_concrete": 2,
    "actionability_10_milestone": 2,
    "insight_11_nontrivial": 2,
    "insight_12_second_order": 2,
    "insight_13_alternatives_analyzed": 2,
    "insight_14_anti_median": 1,
    "insight_15_cross_domain": 1,
    "brand_16_voice": 2,
    "brand_17_anti_slop": 2,
    "brand_18_no_em_dash": 2,
    "brand_19_output_routing": 2,
    "brand_20_tone_audience": 2,
    "risk_21_downside": 2,
    "risk_22_p9_hard_rules": 2,
    "risk_23_crisis_scenarios": 1,
    "risk_24_dependencies": 1,
    "risk_25_reversibility": 2
  },
  "scores": {
    "accuracy": 9.0,
    "actionability": 9.0,
    "insight": 8.0,
    "brand_fit": 9.5,
    "risk_awareness": 8.0
  },
  "weighted_total": 8.7,
  "verdict": "go",
  "primary_gap": "N8: утром дня решения 29.10 на странице заказы по 27.10, а чип говорит «день 14 из 14 · проверка 29.10»; пограничная карточка выглядит как откат. Закрыть до 29.10, мерж не блокирует",
  "gaps": [
    "N8 (medium): утро решения 29.10 - заказы на странице по 27.10, данные за 28.10 приходят на сайт днём (коммит orders-backfill 09:52-13:21 UTC, деплой после OZON snapshots 10:57-13:51 UTC), а если ночной сбор не прошёл (12.10 коммита не было) - на следующий день. Чип «день 14 из 14 · проверка 29.10», дата данных только в свёрнутом «Как считаем». Фикстура dec27: TRUBIS 160 «26, осталось 5, отстаём» при 31 из 31 за полное окно. Правка: при today >= P.check и OD_LAST < W1 красная строка под чипом «Заказы по ДД.ММ: за 28.10 данных ещё нет, решение по полным 14 дням»; в спеке decision - «после прихода заказов за 28.10»; тест «today 29.10, od_last 27.10 - предупреждение есть»",
    "N4 остаток (low): спека осталась version 1 и status approved, хотя менялись блокирующие поля (partial_period, accounting_basis, golden_rows), а эталоны «ждут «да» Ивана». По data-guard SKILL.md нужна новая версия с подписью. Эталоны 137 и 49 тестами не стали, тест есть только у 179 (plan-tab.test.ts:55). Правка: version 2, status draft до «да» Ивана, два теста эталонов",
    "N7 (low): если по товарам нет ни одного полного дня (ADS_FULL пустой, проба wipe3), легенда пишет «Клик и минимальный клик - по . (дальше отчёт по товарам досчитывается)» (client.js:177, dm(D.ad_last) без проверки), спидометр - «нет данных · 0 из 0 тыс. ₽». Причина названа «досчитывается», хотя это сбой отчёта. Правка: при пустом ad_last писать «отчёт по товарам не собран»"
  ],
  "evidence_ledger": [
    {"gap": "N8 утро решения 29.10: окно 13 из 14 дней без заметной пометки", "evidence": "python3 -I p3_fixture_dec.py dec28|dec27; npx tsx p3_render.mts fx new <fx_dec27|fx_dec28> 2026-10-29: dec27 «день 14 из 14», TRUBIS 160 «26 / осталось 5 / отстаём», od_last 27.10; dec28 «31 / 0 / идём». git log --all -- orders_daily.ndjson: 7 коммитов 09:52-13:21 UTC с [skip ci]; коммиты «прямые снимки OZON» 10:57-13:51 UTC; deploy-pages.yml:52-65 (бот не триггерит push, workflow_run после снимков, cron 09:47 UTC); 12.10 коммита заказов нет", "checkpoint": "actionability_7_deadline_buffer", "weight": -0.5},
    {"gap": "N4 остаток: спека v1 approved после смены блокирующих полей, эталоны 137 и 49 без теста, «да» Ивана ждёт", "evidence": "ozon-plan-15-10.yaml:4-7, 29-31, 47-55; .claude/skills/data-guard/SKILL.md:37-46 (эталоны подтверждены и становятся тестом; смена поля = новая версия с подписью); grep 137|49 plan-tab.test.ts: только 179 (:55)", "checkpoint": "accuracy_3_no_conflict_with_rag", "weight": -0.15},
    {"gap": "N7 пустой ADS_FULL: «по .», «0 из 0 тыс. ₽», «досчитывается» вместо «сбой»", "evidence": "python3 -I p3_fixture.py wipe3; npx tsx p3_render.mts fx new fx_wipe3 2026-10-18: легенда «по . (дальше отчёт по товарам досчитывается)», спидометр «нет данных | 0 из 0 тыс. ₽»; plan-tab.client.js:177", "checkpoint": "brand_20_tone_audience", "weight": -0.075}
  ],
  "sources_of_truth": [
    "analytics-mvp/data/orders_daily.ndjson",
    "analytics-mvp/data/ads_daily.ndjson",
    "analytics-mvp/data/ads_sku_daily.ndjson",
    "analytics-mvp/data/ads_sku_state.json",
    "analytics-mvp/data/funnel_tests.ndjson",
    "analytics-mvp/data/card_groups.json",
    "analytics-mvp/data/plan_2026-10-15.json",
    "analytics-mvp/src/scripts/ozon/ad-sku-daily.ts",
    "analytics-mvp/src/connector/ozon-seller.ts:371-381",
    ".github/workflows/orders-backfill.yml",
    ".github/workflows/deploy-pages.yml:49-65",
    ".claude/skills/data-guard/SKILL.md"
  ],
  "confidence": 0.85
}
